{
  "schema_version": 1,
  "scenario": "flexgate-mirror",
  "profile": "ci",
  "target": "http://127.0.0.1:8081",
  "timestamp": "2026-04-13T19:47:56.098Z",
  "git_sha": "dev",
  "hardware": {
    "note": "single-node loopback — see ARCHITECTURE.md §3",
    "os": "unknown",
    "cpu": "unknown"
  },
  "metrics": {
    "rps": {
      "mean": 1436.7816091954023
    },
    "latency_ms": {
      "min": 0,
      "med": 0,
      "p95": 0,
      "max": 0
    },
    "error_rate_pct": 100
  },
  "overhead_vs_baseline": null,
  "thresholds_passed": {}
}